CREATE TABLE DEPARTMENT(DEP_NO NUMBER(38) NOT NULL PRIMARY KEY,DEPT_NAME VARCHAR(25) NOT NULL,LOC VARCHAR(25) NOT NULL,MGR NUMBER(38),EXP_BDG NUMBER(38) NOT NULL,REV_BDG NUMBER(38) NOT NULL);
CREATE TABLE DEPENDANT(PID NUMBER(38) NOT NULL,F_NAME VARCHAR(25) NOT NULL,L_NAME VARCHAR(25) NOT NULL,PLACE VARCHAR(25) NOT NULL,EMPNO NUMBER(38) NOT NULL);

CREATE TABLE EMPLOYEE(EMP_NO NUMBER(38) NOT NULL,NAME VARCHAR(25) NOT NULL,JOB VARCHAR(25) NOT NULL,SALARY NUMBER(38) NOT NULL,COMM VARCHAR(25),DEP_NO NUMBER(38),SEX VARCHAR(6),FOREIGN KEY(DEP_NO) REFERENCES DEPARTMENT(DEP_NO) ON DELETE CASCADE);


INSERT INTO DEPENDANT VALUES(1010,'ANU','JOSE','TRIVANDRUM',214);
INSERT INTO DEPENDANT VALUES(1020,'NEENU','THOMAS','KOLLAM',200);
INSERT INTO DEPENDANT VALUES(1022,'ANAMIKA','THAMPI','KOLLAM',200);
INSERT INTO DEPENDANT VALUES(1031,'SWETHA','DAS','KOTTAYAM',109);




INSERT INTO DEPARTMENT VALUES(60,'SHIPPING','TRIVANDRUM',215,90000,0);
INSERT INTO DEPARTMENT VALUES(10,'ACCOUNTING','COCHIN',200,100000,0);
INSERT INTO DEPARTMENT VALUES(30,'RESEARCH','COCHIN',105,125000,0);
INSERT INTO DEPARTMENT VALUES(40,'SALES','TRICHUR',109,28000,8000);
INSERT INTO DEPARTMENT VALUES(50,'MANUFACTURING','KOTTAYAM',210,13000,0);



INSERT INTO EMPLOYEE VALUES(100,'WILSON','CLRK',17000,NULL,10,'M');
INSERT INTO EMPLOYEE VALUES(101,'SMITHA','SLSM',25000,1300,40,'F');
INSERT INTO EMPLOYEE VALUES(103,'ROY','ANLST',35000,NULL,30,'M');
INSERT INTO EMPLOYEE VALUES(105,'WATSON','MNGR',45000,0,30,'M');
INSERT INTO EMPLOYEE VALUES(109,'ALAN','MNGR',30000,800,40,'M');
INSERT INTO EMPLOYEE VALUES(110,'TINA','CLRK',18000,NULL,50,'F');
INSERT INTO EMPLOYEE VALUES(200,'KARTHIKA','MNGR',29000,NULL,10,'F');
INSERT INTO EMPLOYEE VALUES(210,'RITA','MNGR',36500,NULL,50,'F');
INSERT INTO EMPLOYEE VALUES(213,'MANACY','CLRK',16250,NULL,10,'F');
INSERT INTO EMPLOYEE VALUES(214,'SIMPSON','DRVD',8250,NULL,60,'M');
INSERT INTO EMPLOYEE VALUES(215,'DEEPA','ANLYST',27000,NULL,60,'F');
INSERT INTO EMPLOYEE VALUES(220,'SOOSAN','SLSM',28500,'5300',60,'F');



   EMP_NO NAME 		     JOB			   SALARY COMM				DEP_NO SEX
---------- ------------------------- ------------------------- ---------- ------------------------- ---------- ------
       100 WILSON		     CLRK			    17000				    10 M
       101 SMITHA		     SLSM			    25000 1300				    40 F
       103 ROY			     ANLST			    35000				    30 M
       105 WATSON		     MNGR			    45000 0				    30 M
       109 ALAN 		     MNGR			    30000 800				    40 M
       110 TINA 		     CLRK			    18000				    50 F
       200 KARTHIKA		     MNGR			    29000				    10 F
       210 RITA 		     MNGR			    36500				    50 F
       213 MANACY		     CLRK			    16250				    10 F
       214 SIMPSON		     DRVD			     8250				    60 M
       215 DEEPA		     ANLST			    27000				    60 F

    EMP_NO NAME 		     JOB			   SALARY COMM				DEP_NO SEX
---------- ------------------------- ------------------------- ---------- ------------------------- ---------- ------
       220 SOOSAN		     SLSM			    28500 5300				    60 F

12 rows selected.



 SELECT * FROM DEPARTMENT;

    DEP_NO DEPT_NAME		     LOC			      MGR    EXP_BDG	REV_BDG
---------- ------------------------- ------------------------- ---------- ---------- ----------
	60 SHIPPING		     TRIVANDRUM 		      215      90000	      0
	10 ACCOUNTING		     COCHIN			      200     100000	      0
	30 RESEARCH		     COCHIN			      105     125000	      0
	40 SALES		     TRICHUR			      109      28000	   8000
	50 MANUFACTURING	     KOTTAYAM			      210      13000	      0
	
	
 SELECT * FROM DEPENDANT;

       PID F_NAME		     L_NAME		       PLACE			      EMPNO
---------- ------------------------- ------------------------- ------------------------- ----------
      1010 ANU			     JOSE		       TRIVANDRUM			214
      1020 NEENU		     THOMAS		       KOLLAM				200
      1022 ANAMIKA		     THAMPI		       KOLLAM				200
      1031 SWETHA		     DAS		       KOTTAYAM 			109






1.RETURN SETAILS OF ALL MANAGERS FROM EMPLOYEE TABLE SORTED ALPHABETICALLY BY NAME.
SELECT * FROM EMPLOYEE WHERE JOB='MNGR' ORDER BY NAME;

    EMP_NO NAME 		     JOB			   SALARY COMM				DEP_NO SEX
---------- ------------------------- ------------------------- ---------- ------------------------- ---------- ------
       109 ALAN 		     MNGR			    30000 800				    40 M
       200 KARTHIKA		     MNGR			    29000				    10 F
       210 RITA 		     MNGR			    36500				    50 F
       105 WATSON		     MNGR			    45000 0				    30 M
2.RETURN DETAILS OF ALL EMPLOYEES IN DEPARTMENT 40 ORDERED BY EMP_NO.


SELECT * FROM EMPLOYEE WHERE DEP_NO='40' ORDER BY EMP_NO;

    EMP_NO NAME 		     JOB			   SALARY COMM				DEP_NO SEX
---------- ------------------------- ------------------------- ---------- ------------------------- ---------- ------
       101 SMITHA		     SLSM			    25000 1300				    40 F
       109 ALAN 		     MNGR			    30000 800				    40 M

3.RETURN INFORMATION ABOUT ALL FEMALE EMPLOYEE ORDERED BY NAME.
SELECT * FROM EMPLOYEE WHERE SEX='F' ORDER BY NAME;

    EMP_NO NAME 		     JOB			   SALARY COMM				DEP_NO SEX
---------- ------------------------- ------------------------- ---------- ------------------------- ---------- ------
       215 DEEPA		     ANLST			    27000				    60 F
       200 KARTHIKA		     MNGR			    29000				    10 F
       213 MANACY		     CLRK			    16250				    10 F
       210 RITA 		     MNGR			    36500				    50 F
       101 SMITHA		     SLSM			    25000 1300				    40 F
       220 SOOSAN		     SLSM			    28500 5300				    60 F
       110 TINA 		     CLRK			    18000				    50 F

7 rows selected.
4.FIND MINIMUM,MAXIMUM AND AVERAGE SALARY OF EMPLOYEES IN EACH DEPARTMENT.
SELECT MIN(SALARY),MAX(SALARY),AVG(SALARY),DEP_NO FROM EMPLOYEE GROUP BY DEP_NO;

MIN(SALARY) MAX(SALARY) AVG(SALARY)	DEP_NO
----------- ----------- ----------- ----------
      35000	  45000       40000	    30
      25000	  30000       27500	    40
      18000	  36500       27250	    50
      16250	  29000       20750	    10
       8250	  28500       21250	    60


5. FIND MINIMUM AND MAXIMUM COMMISSION PAID(COMM),TOTAL COMMISSION PAID AND COUNT OF EMPLOYEES WHO WERE PAID WITH  THE COMMISSION.
SELECT MAX(COMM),MIN(COMM),SUM(COMM),COUNT(COMM) FROM EMPLOYEE;

MAX(COMM)		  MIN(COMM)		     SUM(COMM) COUNT(COMM)
------------------------- ------------------------- ---------- -----------
800			  0				  7400		 4


6.NUMBER OF EMPLOYEES LISTED IN EACH JOB.
SELECT JOB,COUNT(EMP_NO) FROM EMPLOYEE GROUP BY JOB;
JOB			  COUNT(EMP_NO)
------------------------- -------------
MNGR				      4
SLSM				      2
CLRK				      3
ANLST				      2
DRVD				      1


7.TOTAL SALARY PAID TO EACH JOB IN THE CATEGORY.
SELECT JOB,SUM(SALARY) FROM EMPLOYEE GROUP BY JOB;
JOB			  SUM(SALARY)
------------------------- -----------
MNGR			       140500
SLSM				53500
CLRK				51250
ANLST				62000
DRVD				 8250


8.RETURN ALL DEPT_NOS IN EMPLOYEE TABLE(ENSURE THAT EACH DEPT_NO APPEARS ONLY ONCE).
SELECT DISTINCT DEP_NO FROM EMPLOYEE;

    DEP_NO
----------
	30
	40
	50
	10
	60

9.RETURN EMP_NO,NAME AND SALARY OF FEMALES IN DEPARTMENT 10.
SELECT EMP_NO,NAME,SALARY FROM EMPLOYEE WHERE SEX='F' AND DEP_NO='10';

    EMP_NO NAME 			 SALARY
---------- ------------------------- ----------
       200 KARTHIKA			  29000
       213 MANACY			  16250


10.RETURN EMP_NO,NAME AND SALARY OF ALL MALE MANAGERS ORDERED BY NAME.
SELECT EMP_NO,NAME,SALARY FROM EMPLOYEE WHERE SEX='M' AND JOB='MNGR' ORDER BY NAME;

    EMP_NO NAME 			 SALARY
---------- ------------------------- ----------
       109 ALAN 			  30000
       105 WATSON			  45000
11.RETURN NAME AND JOB OF ALL FEMALE SALESMAN AND MANAGERS.
SELECT NAME,JOB FROM EMPLOYEE WHERE SEX='F' AND (JOB='SLSM' OR JOB='MNGR');
NAME			  JOB
------------------------- -------------------------
SMITHA			  SLSM
KARTHIKA		  MNGR
RITA			  MNGR
SOOSAN			  SLSM


12.DISPLAY EMP_NO AND NAME OF EMPLOYEES IN EMPLOYEE TABLE WHO ARE EITHER A MANAGER  OR A CLERK IN DEPARTMENT 50.
SELECT EMP_NO,NAME FROM EMPLOYEE WHERE DEP_NO='50' AND (JOB='CLRK' OR JOB='MNGR');
 EMP_NO NAME
---------- -------------------------
       110 TINA
       210 RITA

13.LIST THE NAME OF EMPLOYEE WHO ARE NEITHER A CLERK NOR A SALESMAN.
 SELECT NAME,JOB FROM EMPLOYEE WHERE JOB NOT IN('CLRK','SLSM');

NAME			  JOB
------------------------- -------------------------
ROY			  ANLST
WATSON			  MNGR
ALAN			  MNGR
KARTHIKA		  MNGR
RITA			  MNGR
SIMPSON 		  DRVD
DEEPA			  ANLST

7 rows selected.


14.RETURN DETAILS OF ALL CLERKS WORKING IN DEPARTMENTS OTHER THAN DEPARTMENT 10.SELECT * FROM EMPLOYEE WHERE JOB='CLRK' AND DEP_NO NOT IN 10;

    EMP_NO NAME 		     JOB			   SALARY COMM				DEP_NO SEX
---------- ------------------------- ------------------------- ---------- ------------------------- ---------- ------
       110 TINA 		     CLRK			    18000				    50 F


15.FIND NAMES OF EMPLOYEES CONTAINING LETTERS U AND E.
SELECT NAME FROM EMPLOYEE WHERE NAME LIKE '%U%' AND NAME LIKE '%E%';

no rows selected

16.LIST ALL EMPLOYEE WHO EARNED COMMISSION.
SELECT * FROM EMPLOYEE WHERE COMM>0;
    EMP_NO NAME 		     JOB			   SALARY COMM				DEP_NO SEX
---------- ------------------------- ------------------------- ---------- ------------------------- ---------- ------
       101 SMITHA		     SLSM			    25000 1300				    40 F
       109 ALAN 		     MNGR			    30000 800				    40 M
       220 SOOSAN		     SLSM			    28500 5300				    60 F


17.FIND EMP_NO,NAME AND JOB OF ALL FEMALES WHO ARE NOT MANAGERS.
SELECT EMP_NO,NAME,JOB FROM EMPLOYEE WHERE SEX='F' AND JOB NOT IN 'MNGR';
  EMP_NO NAME 		     JOB
---------- ------------------------- -------------------------
       101 SMITHA		     SLSM
       110 TINA 		     CLRK
       213 MANACY		     CLRK
       215 DEEPA		     ANLST
       220 SOOSAN		     SLSM


18.FIND EMP_NO,NAME AND SALARY OF ALL EMPLOYEES WHO EARN MORE THAN 10000 BUT LESS THAN 40000.
SELECT EMP_NO,NAME,SALARY FROM EMPLOYEE WHERE SALARY>10000 AND SALARY<40000;

    EMP_NO NAME 			 SALARY
---------- ------------------------- ----------
       100 WILSON			  17000
       101 SMITHA			  25000
       103 ROY				  35000
       109 ALAN 			  30000
       110 TINA 			  18000
       200 KARTHIKA			  29000
       210 RITA 			  36500
       213 MANACY			  16250
       215 DEEPA			  27000
       220 SOOSAN			  28500
10 rows selected.


19.USE IN OPERATOR TO FIND NAME AND EMP_NO OF EMPLOYEE WHO ARE ANALYST OR MANAGER ORDERED BY NAME.
SELECT NAME,EMP_NO FROM EMPLOYEE WHERE JOB IN ('ANLST','MNGR') ORDER BY NAME;

NAME			      EMP_NO
------------------------- ----------
ALAN				 109
DEEPA				 215
KARTHIKA			 200
RITA				 210
ROY				 103
WATSON				 105
6 rows selected.


20.FIND THE EMPLOYEE NUMBER,NAME AND SALARY WHO BEEN PAID COMMISSION  AND WHOSE SALARY IS GREATER THAN 30000.
SELECT EMP_NO, NAME,SALARY FROM EMPLOYEE WHERE COMM IS NOT NULL AND SALARY>'3000';
  EMP_NO NAME 			 SALARY
---------- ------------------------- ----------
       101 SMITHA			  25000
       105 WATSON			  45000
       109 ALAN 			  30000
       220 SOOSAN			  28500


21.FIND DEP_NO,DEP_NAME,SALARY,JOB,SEX ORDERED BY EMP_NO WITHIN DEPARTMENT.
 SELECT D.DEP_NO,D.DEPT_NAME,E.SALARY,E.JOB,E.SEX FROM EMPLOYEE E JOIN DEPARTMENT D ON D.DEP_NO=E.DEP_NO ORDER BY E.EMP_NO;
  DEP_NO DEPT_NAME			 SALARY JOB			  SEX
---------- ------------------------- ---------- ------------------------- ------
	10 ACCOUNTING			  17000 CLRK			  M
	40 SALES			  25000 SLSM			  F
	30 RESEARCH			  35000 ANLST			  M
	30 RESEARCH			  45000 MNGR			  M
	40 SALES			  30000 MNGR			  M
	50 MANUFACTURING		  18000 CLRK			  F
	10 ACCOUNTING			  29000 MNGR			  F
	50 MANUFACTURING		  36500 MNGR			  F
	10 ACCOUNTING			  16250 CLRK			  F
	60 SHIPPING			   8250 DRVD			  M
	60 SHIPPING			  27000 ANLST			  F

    DEP_NO DEPT_NAME			 SALARY JOB			  SEX
---------- ------------------------- ---------- ------------------------- ------
	60 SHIPPING			  28500 SLSM			  F

12 rows selected.


22.DISPLAY THE NAME OF THE EMPLOYEE AND DEPENDANT NAME IF DEPENDANT IS STAYING IN THE SAME LOCATION WHERE EMPLOYEE IS WORKING.
  SELECT E.NAME,D.F_NAME,D.L_NAME,X.LOC FROM EMPLOYEE E,DEPENDANT D,DEPARTMENT X WHERE E.DEP_NO=X.DEP_NO AND X.LOC=D.PLACE AND E.EMP_NO=D.EMPNO;
NAME			  F_NAME		    L_NAME
------------------------- ------------------------- -------------------------
LOC
-------------------------
SIMPSON 		  ANU			    JOSE
TRIVANDRUM


23.FIND COMPANY LOCATION OF EMPLOYEE NAMED WATSON.
SELECT E.NAME,D.LOC FROM EMPLOYEE E ,DEPARTMENT D WHERE D.DEP_NO=30 AND E.NAME='WATSON';

NAME			  LOC
------------------------- -------------------------
WATSON			  COCHIN

24.FIND NAME ,EMPNO,DEP_NAME,FOR ALL EMPLOYEE WHO WORK IN 'TRICHUR' AND ORDER BY EMPNO IN DESCENDING ORDER.
SELECT E.NAME,E.EMP_NO,D.DEPT_NAME FROM EMPLOYEE E , DEPARTMENT D WHERE D.DEP_NO=E.DEP_NO AND D.LOC='TRICHUR' ORDER BY E.EMP_NO DESC;

NAME			      EMP_NO DEPT_NAME
------------------------- ---------- -------------------------
ALAN				 109 SALES
SMITHA				 101 SALES


25.RETRIEVE NAME AND SALARY OF ALL EMPLOYEE WHO EARNED MORE THAN THE AVERAGE SALARY.
SELECT NAME ,SALARY FROM EMPLOYEE WHERE SALARY>(SELECT AVG(SALARY) FROM EMPLOYEE);

NAME			      SALARY
------------------------- ----------
ROY			       35000
WATSON			       45000
ALAN			       30000
KARTHIKA		       29000
RITA			       36500
DEEPA			       27000
SOOSAN			       28500

7 rows selected.


26.FIND NAME,JOB,DEP_NAME,LOCATION OF ALL FEMALE EMPLOYEE ORDER BY EMPNAME.
SELECT E.NAME,E.JOB,D.DEPT_NAME,D.LOC FROM EMPLOYEE E ,DEPARTMENT D WHERE E.DEP_NO=D.DEP_NO AND E.SEX='F' ORDER BY E.NAME;
NAME			  JOB			    DEPT_NAME		      LOC
------------------------- ------------------------- ------------------------- -------------------------
DEEPA			  ANLST 		    SHIPPING		      TRIVANDRUM
KARTHIKA		  MNGR			    ACCOUNTING		      COCHIN
MANACY			  CLRK			    ACCOUNTING		      COCHIN
RITA			  MNGR			    MANUFACTURING	      KOTTAYAM
SMITHA			  SLSM			    SALES		      TRICHUR
SOOSAN			  SLSM			    SHIPPING		      TRIVANDRUM
TINA			  CLRK			    MANUFACTURING	      KOTTAYAM

7 rows selected.


27.FIND THE EMP_NAME ,DEPNAME OF ALL MANAGER ORDER BY DEPARTMENT NAME.
SELECT E.NAME,D.DEPT_NAME FROM EMPLOYEE E ,DEPARTMENT D WHERE E.DEP_NO=D.DEP_NO AND E.JOB='MNGR' ORDER BY D.DEPT_NAME;
NAME			  DEPT_NAME
------------------------- -------------------------
KARTHIKA		  ACCOUNTING
RITA			  MANUFACTURING
WATSON			  RESEARCH
ALAN			  SALES


28.FIND NAME AND DEP_NAME OF EMPLOYEE WHO EARNS HIGHEST SALARY.
SELECT E.NAME , D.DEPT_NAME FROM EMPLOYEE E ,DEPARTMENT D WHERE E.DEP_NO=D.DEP_NO AND E.SALARY=(SELECT MAX(SALARY) FROM EMPLOYEE);

NAME			  DEPT_NAME
------------------------- -------------------------
WATSON			  RESEARCH


29.FIND NAME,DEPARTMENTNAME,COMMISSION OF ALL EMPLOYEE WHO PAID COMMISSION ORDER BY NAME.
SELECT E.NAME,E.COMM,D.DEPT_NAME FROM EMPLOYEE E,DEPARTMENT D WHERE E.DEP_NO=D.DEP_NO AND E.COMM IS NOT NULL ORDER BY D.DEPT_NAME;

NAME			  COMM			    DEPT_NAME
------------------------- ------------------------- -------------------------
WATSON			  0			    RESEARCH
SMITHA			  1300			    SALES
ALAN			  800			    SALES
SOOSAN			  5300			    SHIPPING


30.DISPLAY EMPLOYEENAME AND DEPARTMENT NAME OF ALL EMPLOYEES WORKING IN DEPARTMENTS THAT HAS ATLEAST 3 EMPLOYEES.ORDER THE OUTPUT IN ALPHABETICAL ORDER FIRST BY DEPARTMENTNAME AND THEN BY EMPLOYEE NAME.
SELECT E.NAME,D.DEPT_NAME FROM EMPLOYEE E ,DEPARTMENT D WHERE E.DEP_NO=D.DEP_NO AND D.DEP_NO IN(SELECT DEP_NO FROM EMPLOYEE GROUP BY DEP_NO HAVING COUNT(*)>=3) ORDER BY D.DEPT_NAME,E.NAME;

NAME			  DEPT_NAME
------------------------- -------------------------
KARTHIKA		  ACCOUNTING
MANACY			  ACCOUNTING
WILSON			  ACCOUNTING
DEEPA			  SHIPPING
SIMPSON 		  SHIPPING
SOOSAN			  SHIPPING

6 rows selected.


31.FIND NAME,DEPARTMENT NAME AND COMMISSION OF ALL EMPLOYEES WHO NOT PAID COMMISSION ORDER BY NAME.
 SELECT E.NAME,E.COMM,D.DEPT_NAME FROM EMPLOYEE E ,DEPARTMENT D WHERE E.DEP_NO=D.DEP_NO AND E.COMM IS NULL ORDER BY E.NAME;

NAME			  COMM			    DEPT_NAME
------------------------- ------------------------- -------------------------
DEEPA						    SHIPPING
KARTHIKA					    ACCOUNTING
MANACY						    ACCOUNTING
RITA						    MANUFACTURING
ROY						    RESEARCH
SIMPSON 					    SHIPPING
TINA						    MANUFACTURING
WILSON						    ACCOUNTING

8 rows selected.


32.LIST NAME AND SALARY OF ALL EMPLOYEE IN DEPARTMENT NUMBER 10 AND 30.
SELECT E.NAME,E.SALARY FROM EMPLOYEE E WHERE E.DEP_NO IN(10,30);
NAME			      SALARY
------------------------- ----------
WILSON			       17000
ROY			       35000
WATSON			       45000
KARTHIKA		       29000
MANACY			       16250


33.LIST JOBS OF EMPLOYEES IN DEPARTMENT 30 WHICH ARE NOT DONE IN DEPARTMENT 40.
 SELECT DISTINCT JOB FROM EMPLOYEE WHERE DEP_NO=30 AND JOB NOT IN(SELECT DISTINCT JOB FROM EMPLOYEE WHERE DEP_NO=40);

JOB
-------------------------
ANLST



34.LIST OUT JOB AND SALARY OF EMPLOYEES IN DEPARTMENT 10 AND 40 WHO DRAW THE SAME SALARY.SELECT JOB,SALARY FROM EMPLOYEE WHERE DEP_NO IN(10,40) AND SALARY NOT IN(SELECT SALARY FROM EMPLOYEE WHERE DEP_NO IN(10,40));

no rows selected

35.CREATE A VIEW TO DISPLAY EMPNO,NAME,JOB OF EMPLOYEE FROM EMPLOYEE TABLE WHO WORKS AS MANAGER.
 CREATE VIEW MANAGER AS(SELECT EMP_NO,NAME,JOB FROM EMPLOYEE WHERE JOB='MNGR');
View created.

SELECT * FROM MANAGER;

    EMP_NO NAME 		     JOB
---------- ------------------------- -------------------------
       105 WATSON		     MNGR
       109 ALAN 		     MNGR
       200 KARTHIKA                  MNGR
       210 RITA 		     MNGR



36.SELCT EMP_NO,NAME,JOB AND SALARY OF EMPLOYEE WHO WORKS AS CLERK AND HAVING SALARY GREATER THAN 1650.
 SELECT EMP_NO,NAME,JOB,SALARY FROM EMPLOYEE WHERE JOB='MNGR' AND SALARY>1650;

    EMP_NO NAME 		     JOB			   SALARY
---------- ------------------------- ------------------------- ----------
       105 WATSON		     MNGR			    45000
       109 ALAN 		     MNGR			    30000
       200 KARTHIKA		     MNGR			    29000
       210 RITA 		     MNGR			    36500


37.CREATE AN INDEX FOR COLUMN FNAME AND LNAME IN DEPENDANT TABLE.
CREATE INDEX DEP ON DEPENDANT(F_NAME,L_NAME);

Index created.
SELECT INDEX_NAME,TABLE_NAME FROM ALL_INDEXES WHERE TABLE_NAME='DEPENDANT';

INDEX_NAME		       TABLE_NAME
------------------------------ ------------------------------
DEP			       DEPENDANT


38. DELETE PERSON WITH ID=1031 IN DEPENDANT TABLE.
DELETE FROM DEPENDANT WHERE PID='1031';

1 row deleted.
SELECT * FROM DEPENDANT;

       PID F_NAME		     L_NAME		       PLACE			      EMPNO
---------- ------------------------- ------------------------- ------------------------- ----------
      1010 ANU			     JOSE		       TRIVANDRUM			214
      1020 NEENU		     THOMAS		       KOLLAM				200
      1022 ANAMIKA		     THAMPI		       KOLLAM				200

39.RETURN EMPNO,NAME,SALARY OF ANY ONE OF THE FEMALES IN DEPARTMENT 10;
SELECT EMP_NO,NAME,SALARY FROM EMPLOYEE WHERE SEX='F' AND DEP_NO=10 AND ROWNUM<=1;
    EMP_NO NAME 			 SALARY
---------- ------------------------- ----------
       200 KARTHIKA			  29000


40.DELETE THE EMPLOYEE KARTHIKA WITH ALL HER DEPENDANTS.

DELETE FROM DEPENDANT WHERE EMPNO='200';
2 rows deleted.
DELETE FROM EMPLOYEE WHERE NAME='KARTHIKA';

1 row deleted.
 SELECT * FROM DEPENDANT;

       PID F_NAME		     L_NAME		       PLACE			      EMPNO
---------- ------------------------- ------------------------- ------------------------- ----------
      1010 ANU			     JOSE		       TRIVANDRUM			214


