create table product(product_no varchar(15) not null,description varchar(15) not null,company varchar(15) not null,price int not null,primary key(product_no));
CREATE TABLE CUSTOMER(CUST_NO VARCHAR(15) PRIMARY KEY NOT NULL,NAME VARCHAR(15) NOT NULL,AGE INT NOT NULL,CITY VARCHAR(15) NOT NULL,PINCODE INT NOT NULL,STATE VARCHAR(15) NOT NULL);
CREATE TABLE SUPPLIER( S_NO VARCHAR(25)  PRIMARY KEY NOT NULL,SNAME VARCHAR(15) NOT NULL,AGE INT NOT NULL,CITY VARCHAR(15) NOT NULL);
CREATE TABLE PURCHASE(ORDER_NO VARCHAR(15) NOT NULL PRIMARY KEY,CUST_NO VARCHAR(15) NOT NULL,PRODUCT_NO VARCHAR(15) NOT NULL,QUANTITY INT NOT NULL,ORDER_DATE DATE,FOREIGN KEY(CUST_NO) REFERENCES CUSTOMER(CUST_NO),FOREIGN KEY(PRODUCT_NO) REFERENCES PRODUCT(PRODUCT_NO) ON DELETE CASCADE);


INSERT INTO PRODUCT VALUES('P00001','12W FLOOD LIGHT','WIPRO','5000');
INSERT INTO PRODUCT VALUES('P00002','LAPTOP ADAPTER','DELL','1560');
INSERT INTO PRODUCT VALUES('P00003','TABLET','HCL','1100');
INSERT INTO PRODUCT VALUES('P00004','GARNET 50W LED','WIPRO','999');
INSERT INTO PRODUCT VALUES('P00005','LAPTOP CHARGER','HCL','1690');




INSERT INTO CUSTOMER VALUES('C00001','IVAN BARGOSS',35,'BOMBAY',400054,'MAHARASHTRA');
INSERT INTO CUSTOMER VALUES('C00002','VANDANA SAITWAL','35','MADRAS','780001','TAMIL NADU');
INSERT INTO CUSTOMER VALUES('C00003','PRAMADA JAGUSTE',55,'BOMBAY',400057,'MAHARASHTRA');
INSERT INTO CUSTOMER VALUES('C00004','BASU NAVINGDI',45,'BOMBAY',400056,'MAHARASHTRA');
 INSERT INTO CUSTOMER VALUES('C00005','RAVI SREEDHARAN',25,'DELHI',100001,'DELHI');
 INSERT INTO CUSTOMER VALUES('C00006','RUKMINI',25,'MADRAS',780001,'TAMIL NADU');
 
 
INSERT INTO SUPPLIER VALUES('S001','IVAN BARGOSS',35,'BOMBAY');
INSERT INTO SUPPLIER VALUES('S002','NIRMALA AGARWAL',35,'MADRAS');
INSERT INTO SUPPLIER VALUES('C003','SUSMITHA',55,'BOMBAY');
INSERT INTO SUPPLIER VALUES('C004','BASU NAVINGDI',45,'BOMBAY');
INSERT INTO SUPPLIER VALUES('C005','RAVI SREEDHARAN',25,'DELHI');
INSERT INTO SUPPLIER VALUES('C006','NANDA GOPAL',25,'MADRAS');




INSERT INTO PURCHASE VALUES('O00001','C00002','P00003','2','20-JAN-16');
INSERT INTO PURCHASE VALUES('O00002','C00003','P00002','1','27-JAN-16');
INSERT INTO PURCHASE VALUES('O00003','C00006','P00001','3','20-FEB-16');
INSERT INTO PURCHASE VALUES('O00004','C00003','P00005','4','07-APR-16');
INSERT INTO PURCHASE VALUES('O00005','C00004','P00002','2','27-MAY-16');
INSERT INTO PURCHASE VALUES('O00006','C00005','P00004','1','26-MAY-16');






SELECT * FROM PURCHASE;

ORDER_NO	CUST_NO 	PRODUCT_NO	  QUANTITY ORDER_DATE
--------------- --------------- --------------- ---------- ------------------
O00001		C00002		P00003			 2 20-JAN-16
O00002		C00003		P00002			 1 27-JAN-16
O00003		C00006		P00001			 3 20-FEB-16
O00004		C00003		P00005			 4 07-APR-16
O00005		C00004		P00002			 2 27-MAY-16
O00006		C00005		P00004			 1 26-MAY-16

6 rows selected.




SELECT * FROM PRODUCT;

PRODUCT_NO	DESCRIPTION	COMPANY 	     PRICE
--------------- --------------- --------------- ----------
P00001		12W FLOOD LIGHT WIPRO		      5000
P00002		LAPTOP ADAPTER	DELL		      1560
P00003		TABLET		HCL		      1100
P00004		GARNET 50W LED	WIPRO		       999
P00005		LAPTOP CHARGER	HCL		      1690




 SELECT * FROM CUSTOMER;

CUST_NO 	NAME		       AGE CITY 	      PINCODE
--------------- --------------- ---------- --------------- ----------
STATE
---------------
C00001		IVAN BARGOSS		35 BOMBAY	       400054
MAHARASHTRA

C00002		VANDANA SAITWAL 	35 MADRAS	       780001
TAMIL NADU

C00003		PRAMADA JAGUSTE 	55 BOMBAY	       400057
MAHARASHTRA


CUST_NO 	NAME		       AGE CITY 	      PINCODE
--------------- --------------- ---------- --------------- ----------
STATE
---------------
C00004		BASU NAVINGDI		45 BOMBAY	       400056
MAHARASHTRA

C00005		RAVI SREEDHARAN 	25 DELHI	       100001
DELHI

C00006		RUKMINI 		25 MADRAS	       780001
TAMIL NADU


6 rows selected.



SELECT * FROM SUPPLIER;

S_NO			  SNAME 		 AGE CITY
------------------------- --------------- ---------- ---------------
S001			  IVAN BARGOSS		  35 BOMBAY
S002			  NIRMALA AGARWAL	  35 MADRAS
C003			  SUSMITHA		  55 BOMBAY
C004			  BASU NAVINGDI 	  45 BOMBAY
C005			  RAVI SREEDHARAN	  25 DELHI
C006			  NANDA GOPAL		  25 MADRAS

6 rows selected.



1.SELECT NAME FROM CUSTOMER WHERE CITY='MADRAS';
NAME
---------------
VANDANA SAITWAL
RUKMINI

2.SELECT CUST_NO FROM PURCHASE WHERE ORDER_DATE LIKE '__-JAN-__';
CUST_NO
---------------
C00002
C00003


3.SELECT COMPANY FROM PRODUCT WHERE PRICE>5000;
no rows selected

4.SELECT NAME FROM CUSTOMER WHERE NAME LIKE 'R%';

NAME
---------------
RAVI SREEDHARAN
RUKMINI


5.ALTER TABLE CUSTOMER ADD EMAIL VARCHAR(15);
Table altered.


6.SELECT NAME FROM CUSTOMER WHERE AGE>40 AND STATE='MAHARASHTRA';
NAME
---------------
PRAMADA JAGUSTE
BASU NAVINGDI

7.SELECT COMPANY FROM PRODUCT ORDER BY PRICE;
COMPANY
---------------
WIPRO
HCL
DELL
HCL
WIPRO

8.SELECT AVG(AGE) FROM CUSTOMER;
  AVG(AGE)
----------
36.6666667

9.SELECT CITY FROM CUSTOMER WHERE STATE IN('MAHARASHTRA','TAMIL NADU');
CITY
---------------
BOMBAY
MADRAS
BOMBAY
BOMBAY
MADRAS

10.SELECT AVG(PRICE) FROM PRODUCT;
AVG(PRICE)
----------
    2069.8

11.SELECT CUST_NO FROM PURCHASE ORDER BY QUANTITY;
CUST_NO
---------------
C00003
C00005
C00002
C00004
C00006
C00003

6 rows selected.

12.INSERT INTO PRODUCT VALUES('P00008','LAPTOP','APPLE','2000');
   UPDATE PURCHASE SET PRODUCT_NO='P00008' WHERE CUST_NO='C00003';
   2 rows updated.

13.SELECT COUNT(*) FROM CUSTOMER WHERE CITY='DELHI';

SELEC COUNT(*)
----------
	 1
14. CUST_NO FROM PURCHASE WHERE QUANTITY>3;
CUST_NO
---------------
C00003


15.
UPDATE PURCHASE SET ORDER_DATE=NULL;

5 rows updated.

SQL> SELECT * FROM PURCHASE;

ORDER_NO	CUST_NO 	PRODUCT_NO	  QUANTITY ORDER_DATE
--------------- --------------- --------------- ---------- ------------------
O00002		C00003		P00008			 1
O00003		C00006		P00001			 3
O00004		C00003		P00008			 4
O00005		C00004		P00002			 2
O00006		C00005		P00004			 1

SQL> ALTER TABLE PURCHASE MODIFY ORDER_DATE VARCHAR(10);

Table altered.



16.SELECT MIN(PRICE),MAX(PRICE) FROM PRODUCT;
MIN(PRICE) MAX(PRICE)
---------- ----------
       999	 5000


17.SELECT COMPANY,COUNT(*) FROM PRODUCT WHERE COMPANY IN('WIPRO','HCL') GROUP BY COMPANY;
SELECT COMPANY,COUNT(*) FROM PRODUCT WHERE COMPANY IN('WIPRO','HCL') GROUP BY COMPANY;

COMPANY 	  COUNT(*)
--------------- ----------
HCL			 2
WIPRO			 2

18.SELECT NAME FROM CUSTOMER ORDER BY NAME;
NAME
---------------
BASU NAVINGDI
IVAN BARGOSS
PRAMADA JAGUSTE
RAVI SREEDHARAN
RUKMINI
VANDANA SAITWAL

6 rows selected.

19.SELECT * FROM PURCHASE ORDER BY ORDER_DATE DESC;


ORDER_NO	CUST_NO 	PRODUCT_NO	  QUANTITY ORDER_DATE
--------------- --------------- --------------- ---------- ------------------
O00005		C00004		P00002			 2 27-MAY-16
O00006		C00005		P00004			 1 26-MAY-16
O00004		C00003		P00005			 4 07-APR-16
O00003		C00006		P00001			 3 20-FEB-16
O00002		C00003		P00002			 1 27-JAN-16
O00001		C00002		P00003			 2 20-JAN-16

6 rows selected.

20.DELETE PRODUCT WHERE PRODUCT_NO='P00003';
1 row deleted.


21.CREATE TABLE NEW AS SELECT ORDER_NO  ORDER_DATE FROM PURCHASE;
SELECT * FROM NEW;
Table created.


22.DROP TABLE NEW;

Table dropped.

23.CREATE VIEW NEW_T AS SELECT NAME,CITY FROM CUSTOMER WHERE CITY='BOMBAY';
  view created


24.SELECT CUSTOMER.NAME FROM CUSTOMER,PURCHASE WHERE CUSTOMER.CUST_NO=PURCHASE.CUST_NO AND QUANTITY>=1;
NAME
NAME
---------------
PRAMADA JAGUSTE
PRAMADA JAGUSTE
BASU NAVINGDI
RAVI SREEDHARAN
RUKMINI


25.SELECT CUSTOMER.CITY,PURCHASE.ORDER_NO,PURCHASE.CUST_NO FROM PURCHASE JOIN CUSTOMER ON PURCHASE.CUST_NO=CUSTOMER.CUST_NO ORDER BY CUSTOMER.CITY;

CITY		ORDER_NO	CUST_NO
--------------- --------------- ---------------
BOMBAY		O00004		C00003
BOMBAY		O00002		C00003
BOMBAY		O00005		C00004
DELHI		O00006		C00005
MADRAS		O00003		C00006


26.SELECT NAME FROM CUSTOMER WHERE NAME LIKE 'R%';
NAME
NAME
---------------
RAVI SREEDHARAN
RUKMINI




27.SELECT NAME FROM CUSTOMER UNION SELECT SNAME FROM SUPPLIER;

NAME
---------------
BASU NAVINGDI
IVAN BARGOSS
NANDA GOPAL
NIRMALA AGARWAL
PRAMADA JAGUSTE
RAVI SREEDHARAN
RUKMINI
SUSMITHA
VANDANA SAITWAL

9 rows selected.


